[
  {
    "schema_version": "1.0",
    "record_id": "PNE2025-PRI-ESP-DIAG-B1",
    "record_type": "bloque",
    "parent_id": null,
    "spec_version": "PNE2025",
    "application": "diagnostica",
    "subject": "espanol",
    "ordinal": 1,
    "text_es": "Comprensión lectora",
    "provenance": "official",
    "source": { "document_id": "MEP-MARCO-ESPEC-PRI-2025", "file_name": "Marco-de-especificaciones-de-Primaria-2025.pdf", "file_sha256": "804dbb9f6035278f63dedada20663f2e98d90a34b16a64215ac1475045cb45cd", "page": 29, "table": "Tabla 5" },
    "extraction": { "method": "pdf_text", "tool_version": "pdftotext 25.07.0", "extracted_at": "2026-10-21T14:00:00Z" },
    "review": { "status": "pending" }
  },
  {
    "schema_version": "1.0",
    "record_id": "PNE2025-PRI-ESP-DIAG-B1-A1",
    "record_type": "afirmacion",
    "parent_id": "PNE2025-PRI-ESP-DIAG-B1",
    "spec_version": "PNE2025",
    "application": "diagnostica",
    "subject": "espanol",
    "ordinal": 1,
    "text_es": "Distingue las ideas fundamentales en textos no literarios.",
    "provenance": "official",
    "source": { "document_id": "MEP-MARCO-ESPEC-PRI-2025", "file_name": "Marco-de-especificaciones-de-Primaria-2025.pdf", "file_sha256": "804dbb9f6035278f63dedada20663f2e98d90a34b16a64215ac1475045cb45cd", "page": 29, "table": "Tabla 5" },
    "extraction": { "method": "pdf_text", "tool_version": "pdftotext 25.07.0", "extracted_at": "2026-10-21T14:00:00Z" },
    "review": { "status": "pending" }
  },
  {
    "schema_version": "1.0",
    "record_id": "PNE2025-PRI-ESP-DIAG-B1-A1-E8",
    "record_type": "evidencia",
    "parent_id": "PNE2025-PRI-ESP-DIAG-B1-A1",
    "spec_version": "PNE2025",
    "application": "diagnostica",
    "subject": "espanol",
    "ordinal": 8,
    "text_es": "Identifica las ideas fundamentales en textos no literarios.",
    "provenance": "official",
    "source": { "document_id": "MEP-MARCO-ESPEC-PRI-2025", "file_name": "Marco-de-especificaciones-de-Primaria-2025.pdf", "file_sha256": "804dbb9f6035278f63dedada20663f2e98d90a34b16a64215ac1475045cb45cd", "page": 29, "table": "Tabla 5" },
    "extraction": { "method": "pdf_text", "tool_version": "pdftotext 25.07.0", "extracted_at": "2026-10-21T14:00:00Z" },
    "review": { "status": "pending" }
  },
  {
    "schema_version": "1.0",
    "record_id": "PNE2025-PRI-MAT-DIAG-B1",
    "record_type": "bloque",
    "parent_id": null,
    "spec_version": "PNE2025",
    "application": "diagnostica",
    "subject": "matematicas",
    "ordinal": 1,
    "text_es": "Números",
    "provenance": "official",
    "source": { "document_id": "MEP-MARCO-ESPEC-PRI-2025", "file_name": "Marco-de-especificaciones-de-Primaria-2025.pdf", "file_sha256": "804dbb9f6035278f63dedada20663f2e98d90a34b16a64215ac1475045cb45cd", "page": 37, "table": "Tabla 7" },
    "extraction": { "method": "pdf_text", "tool_version": "pdftotext 25.07.0", "extracted_at": "2026-10-21T14:00:00Z" },
    "review": { "status": "pending" }
  },
  {
    "schema_version": "1.0",
    "record_id": "PNE2025-PRI-MAT-DIAG-B1-A3",
    "record_type": "afirmacion",
    "parent_id": "PNE2025-PRI-MAT-DIAG-B1",
    "spec_version": "PNE2025",
    "application": "diagnostica",
    "subject": "matematicas",
    "ordinal": 3,
    "text_es": "Resuelve problemas, de diversos contextos, relacionados a los conceptos básicos de la teoría de números.",
    "provenance": "official",
    "source": { "document_id": "MEP-MARCO-ESPEC-PRI-2025", "file_name": "Marco-de-especificaciones-de-Primaria-2025.pdf", "file_sha256": "804dbb9f6035278f63dedada20663f2e98d90a34b16a64215ac1475045cb45cd", "page": 37, "table": "Tabla 7" },
    "extraction": { "method": "pdf_text", "tool_version": "pdftotext 25.07.0", "extracted_at": "2026-10-21T14:00:00Z" },
    "review": { "status": "pending" }
  },
  {
    "schema_version": "1.0",
    "record_id": "PNE2025-PRI-MAT-DIAG-B1-A3-E2",
    "record_type": "evidencia",
    "parent_id": "PNE2025-PRI-MAT-DIAG-B1-A3",
    "spec_version": "PNE2025",
    "application": "diagnostica",
    "subject": "matematicas",
    "ordinal": 2,
    "text_es": "Aplica los conceptos de divisibilidad, divisor o factor de un número natural, en situaciones de diversos contextos.",
    "provenance": "official",
    "source": { "document_id": "MEP-MARCO-ESPEC-PRI-2025", "file_name": "Marco-de-especificaciones-de-Primaria-2025.pdf", "file_sha256": "804dbb9f6035278f63dedada20663f2e98d90a34b16a64215ac1475045cb45cd", "page": 37, "table": "Tabla 7" },
    "extraction": { "method": "pdf_text", "tool_version": "pdftotext 25.07.0", "extracted_at": "2026-10-21T14:00:00Z" },
    "review": { "status": "pending" }
  },
  {
    "schema_version": "1.0",
    "record_id": "PNE2025-PRI-EST-DIAG-B2",
    "record_type": "bloque",
    "parent_id": null,
    "spec_version": "PNE2025",
    "application": "diagnostica",
    "subject": "estudios_sociales",
    "ordinal": 2,
    "text_es": "Educación Cívica",
    "provenance": "official",
    "source": { "document_id": "MEP-MARCO-ESPEC-PRI-2025", "file_name": "Marco-de-especificaciones-de-Primaria-2025.pdf", "file_sha256": "804dbb9f6035278f63dedada20663f2e98d90a34b16a64215ac1475045cb45cd", "page": 35 },
    "extraction": { "method": "pdf_text", "tool_version": "pdftotext 25.07.0", "extracted_at": "2026-10-21T14:00:00Z" },
    "review": { "status": "pending" }
  },
  {
    "schema_version": "1.0",
    "record_id": "PNE2025-PRI-EST-DIAG-B2-A6",
    "record_type": "afirmacion",
    "parent_id": "PNE2025-PRI-EST-DIAG-B2",
    "spec_version": "PNE2025",
    "application": "diagnostica",
    "subject": "estudios_sociales",
    "ordinal": 6,
    "text_es": "Comprende el papel de los símbolos nacionales en la consolidación del Estado Nación costarricense (Escudo, Bandera e Himno Nacional).",
    "provenance": "official",
    "source": { "document_id": "MEP-MARCO-ESPEC-PRI-2025", "file_name": "Marco-de-especificaciones-de-Primaria-2025.pdf", "file_sha256": "804dbb9f6035278f63dedada20663f2e98d90a34b16a64215ac1475045cb45cd", "page": 36 },
    "extraction": { "method": "pdf_text", "tool_version": "pdftotext 25.07.0", "extracted_at": "2026-10-21T14:00:00Z" },
    "review": { "status": "pending" }
  },
  {
    "schema_version": "1.0",
    "record_id": "PNE2025-PRI-EST-DIAG-B2-A6-E1",
    "record_type": "evidencia",
    "parent_id": "PNE2025-PRI-EST-DIAG-B2-A6",
    "spec_version": "PNE2025",
    "application": "diagnostica",
    "subject": "estudios_sociales",
    "ordinal": 1,
    "text_es": "Relaciona la importancia de los símbolos nacionales de Costa Rica con su significado (Escudo, Bandera e Himno Nacional).",
    "provenance": "official",
    "source": { "document_id": "MEP-MARCO-ESPEC-PRI-2025", "file_name": "Marco-de-especificaciones-de-Primaria-2025.pdf", "file_sha256": "804dbb9f6035278f63dedada20663f2e98d90a34b16a64215ac1475045cb45cd", "page": 36 },
    "extraction": { "method": "pdf_text", "tool_version": "pdftotext 25.07.0", "extracted_at": "2026-10-21T14:00:00Z" },
    "review": { "status": "pending" }
  }
]
